id	corpus	sentence	token	complexity
336OE47KI2KM2XE1PZVRNWJXPYKVWU	biomed	Few studies of LCA animal models have extended their examination of retinal pathology to the ultrastructural level.	Few studies	0.1111111111111111
3MQY1YVHS3KLH3IO6YFKYD91IZ92BD	biomed	These data add a new dimension to the complexity of the regulation of the glycolytic pathway, in particular in the CNS, where glycolysis plays a major role in supplying energy and where the proteasome machinery may play a critical role in modulating components of the energy supply machinery [43].	major role	0.13235294117647056
32ZCLEW0BZKNRTH6WO3DSE071EAPJ8	biomed	These transcripts could give rise to defective calpain small subunits with 10-30 inappropriate C-terminal acids, which might be sufficient to support a low level of calpain activity.	low level	0.15000000000000002
3QGHA0EA0J07TJGVKI4RMKPQM64WBP	biomed	In HD patients and in accurate genetic replicas, HD CAG knock-in mice, the dominant mutation specifically affects the major population of neurons in the striatum, without impairing huntingtin's essential activities in embryonic development [50-53].	essential activities	0.15000000000000002
3RWB1RTQDJNY7CLN5K6M3ORTL3G8P7	biomed	Several studies have used pharmacological manipulations to investigate the contribution of dopamine receptor subtypes in various stages of associative learning [1,2,14].	Several studies	0.16176470588235292
3HUR21WDDUPIVREW4FEXWE1YGHRXYX	biomed	These results suggested that there might be a different mechanism of motor function between swimming and the rotating rod task.	motor function	0.175
3X4Q1O9UBHMCMY43GF110OQ80EEO7J	biomed	First, the disease may be a result of haploinsufficiency at ITPR1; this concept is consistent with the observation that heterozygous deletion leads to a later onset disorder in humans, whereas homozygous deletion in mice leads to an early onset disorder, able to be expressed within the much shorter life span of the mouse.	life span	0.1764705882352941
39KMGHJ4RZAD16C0TVEHV8K3UXS005	biomed	Therefore, TGF and BMP signaling are playing distinct but necessary roles to maintain articular cartilage.	necessary roles	0.18055555555555558
3W1K7D6QSBHBNEL0V5OYLOJ8388BZU	biomed	Huntingtin's large number of diverse cytoplasmic and nuclear protein binding partners strongly suggest that huntingtin may participate in a variety of cellular processes that range from trafficking of growth factor complexes to gene transcription (reviewed in [5,8,9].	large number	0.19117647058823528
3MJ28H2Y1E8XZUQKSMM424CC98JO54	biomed	The different lines examined, however, are very likely to differ genetically from CAPAN-1 cells not only at the BRCA2 locus, but also at a very large number of additional loci.	large number	0.2666666666666667
33NOQL7T9OZSLGNTST4OUMT7V2NZ8J	biomed	Since virtually all M-opsin-expressing cells are localized at the outer edge of the ONL by P28 in the rd7 mutant (Figure S8), any increase in M-opsin transcript in the mutant must have occurred in cells in that location.	outer edge	0.19444444444444442
3QQUBC64ZEEOJSAIXD5MFY3RCXONXY	biomed	However, it is noteworthy that the low statistical threshold and small number of animals per group could lead to some false positive results.	positive results	0.19642857142857145
3MVY4USGB6NO9ADS6NM7BIQIBJSIS5	biomed	To date, very few genes have been reported that show species specific alternative splice variants.	few genes	0.19642857142857145
3S1L4CQSFX50ZNP8OFUVNLJK9LTFAF	biomed	A genome database search revealed orthologs of ADAM11, ADAM22 and ADAM23 genes to exist in vertebrates such as mammals, fish, and amphibians, but not in invertebrates.	database search	0.2
3B9XR6P1WEVLNZGWDJLCXUVIKAVJBH	biomed	The pathogenesis of the wide range of metabolic disturbances in MCAD deficiency is poorly understood and certain aspects of patient management are controversial.	wide range	0.21666666666666667
34R0BODSP1ZBN3DVY8J8XSIY56D5EH	biomed	Although this property may be a major contributor to the maintenance of lens clarity, the early changes in the alphaA/BKO lenses indicate a much broader cellular function for alpha-crystallin.	major contributor	0.2222222222222222
3HXCEECSQMT70MEB5X2ITZH9OHPZYW	biomed	At present, there is no obvious explanation for this result.	obvious explanation	0.2222222222222222
3XEDXEGFX3OFEWJ4XOOZESZC8VY0KB	biomed	Mice with Shh overexpression died less than 24 h after birth, probably owing to respiratory failure.	respiratory failure	0.2222222222222222
3IVKZBIBJ09ODF28054MB6P3B6DHSB	biomed	By this stage, cholesterol levels were already lower and its immediate precursor, 7-DHC, elevated in the lungs (this study) as well as in the whole body [16,17].	whole body	0.22368421052631576
36FFXPMST9O9FNAFTONDR1F2EHAHOE	biomed	Once committed, a small cluster of epithelial cells, the placode, instructs a group of underlying mesenchymal cells to condense and form the nascent dermal papilla, which will be a permanent fixture of the hair follicle.	hair follicle	0.22499999999999998
3X55NP42EOGC6FFHT3BQC7JI5HO3PA	biomed	In obese patients, skeletal muscle has been observed to have reduced oxidative capacity, increased glycolytic capacity, and a decreased percentage of type I fibers (Hickey et al. 1995; Tanner et al. 2002).	obese patients	0.23214285714285715
3WUVMVA7OB3644G8PRO2QDZ2LQNAZY	biomed	Dual color imaging of several GFP variant proteins is a very attractive prospect and has become a standard procedure in cell biology [7,8].	color imaging	0.23214285714285715
3S829FDFT21FXGJ58JRJJTRXYTMDX6	biomed	Human patients present with hypoglycemia, hypoketonemia, and nonketotic organic aciduria precipitated by fasting, most frequently during the first 24 mo in life [1].	Human patients	0.23333333333333334
3FBEFUUYRK54GUWXNMRRTF67GMQ6A3	biomed	It is interesting that the SOX9 transcription factor continues to be expressed in mutant cartilage despite loss of Col2a1, a direct target of this transcription factor (Bell et al. 1997; Lefebvre et al. 1997).	direct target	0.234375
37S0QRNUFBGD1KM6J34BH2W3WTG88N	biomed	These data evidence a key role for p150CAF-1 during pre-implantation development, and reveal that this protein is required for the proper 3-D organization of heterochromatin within embryonic cell nuclei.	key role	0.25
3S1L4CQSFX50ZNP8OFUVNLJK9LTAFA	biomed	Having excluded a direct role in vesicle formation and membrane fusion, annexin A7 might act by its property as Ca2+-binding protein [17].	direct role	0.234375
356ZPKYPUHHDMIC5IO4G21FVEIJYPB	biomed	Aqp2F204V/F204V mice have dramatically increased urine production, in some cases producing an amount of urine in 24 h that exceeds their body weight, compared to their heterozygous or wild-type littermates.	body weight	0.23529411764705882
322ZSN9Z5GKVG3RSAYPTRMCL8K5T4Q	biomed	Sam68 protein expression was observed throughout the developing mouse embryo, in keeping with previous reports that identified the Sam68 mRNA to be widely expressed [38].	previous reports	0.2361111111111111
3NFWQRSHVEE19E2BAFM5J7UN7G6GFS	biomed	Although this property may be a major contributor to the maintenance of lens clarity, the early changes in the alphaA/BKO lenses indicate a much broader cellular function for alpha-crystallin.	early changes	0.23809523809523808
3WRKFXQBOB7L5WP15TEWT4EJS4OYIZ	biomed	Relevant to gene therapy, recent problems with gene therapy in humans highlight the importance and critical need of animal models of genetic diseases for preclinical studies.	critical need	0.25
30P8I9JKOILSPEZHTY8IXW6K51G5VN	biomed	Past experiments seeking to explore the possible involvement of dopamine D2Rs in associative learning have utilized low to moderate doses of drugs [2,5,6] and site-specific administration [7,9] in order to avoid the confounding effect that locomotor disruption associated with acute D2R blockade can have on learning performance in rodents.	Past experiments	0.25
31J7RYECZLQQ5RM4E7407XV12NA1LJ	biomed	Preliminary data (Wangemann et al., unpublished) support a role for pendrin in HCO3 - secretion into endolymph.	Preliminary data	0.25
304QEQWKZPKY4N4JVGGSL9GLS08O0J	biomed	In MD rat, early death is caused by the dysfunction of the brain stem which is essential for autonomic control of respiration during hypoxia [24].	early death	0.25
3M7OI89LVYOS99TV70NIZAWVGPB6C5	biomed	The initial reports of patients with ESCS attributed the unusual ERG to an abnormally functioning rod photoreceptor system with persistent activity under light adaptation [68].	initial reports	0.25
3J94SKDEKIP6VXZV2D8ORA0D5UCD5W	biomed	Similar observations have been made in type 2 diabetic patients (Lillioja et al. 1987; Hickey et al. 1995).	diabetic patients	0.25
3D1UCPY6GG9R0NG07M9FQLOSG7O38Q	biomed	In MRL/Mp mice, the presence of the lpr gene accelerates the development of high level and broad-spectrum auto-Ab production and lethal glomerulonephritis, in addition to marked lymphoproliferative disease.	high level	0.25
3DFYDSXB2W00JYP2DA272KN69V2JUY	biomed	The adult heterozygous females showed a mild tendency toward increased urinary output and water intake and decreased urine osmolality.	mild tendency	0.26388888888888884
3XDSWAMB22SLJRCFM91G5FDMGQNCQ8	biomed	Neurotrophin-3 (NT-3) is a key requirement for the development of proprioceptive inputs to motor neurons (Chen and Frank 1999; Chen et al. 2003).	key requirement	0.26388888888888884
3JVP4ZJHDPSO81TGXL3N1CKZGR90I0	biomed	To identify molecules essential in ES cells for these properties, several groups have utilized transcriptome analyses to identify genes specifically expressed in ES cells and early embryos.	several groups	0.26388888888888884
3SZYX62S5G0QEOYLB052RIQHJJ957V	biomed	Immunoblots of protein extracts from stable cell lines showed that MDCK cells recapitulate the glycosylation defect seen in mutant mice (unpublished data).	unpublished data	0.26388888888888884
3L1EFR8WWT5MU4F3W9GVRQ8033B9FU	biomed	Although we have tried to monitor the expression of L-Sox5 or Sox6 in postnatal articular cartilage, and test the phosphorylation state of SOX9 using previously described reagents (Lefebvre et al. 1998; Huang et al. 2000), we have been unable to obtain specific signal at the late postnatal stages required (unpublished data).	unpublished data	0.2894736842105263
3SNR5F7R92TNZR8A5S22M1M3ASJIE4	biomed	In support of this view are several studies demonstrating that the disruption of dopamine signaling via acute blockade of dopamine receptors with dopamine receptor antagonists [3-9] or 6-OHDA lesions [1,10,11] do not disrupt phase 1, the palatability or primary reinforcing characteristics of a natural reinforcer (e.g. palatability) but disrupt phase 2, the formation of incentive salience.	several studies	0.2647058823529411
3LN50BUKPVBTMJ56Z9FQ8TDZ53FLP6	biomed	However, using homologous recombination in ES cells to generate mutant mice is an inefficient, slow and expensive method because (i) homologous recombination typically occurs at low frequency in ES cells, requiring sophisticated selection schemes and screening of hundreds of clones to identify the desired mutant; (ii) large (1520 kb) plasmids, often difficult to clone, are required to increase targeting efficiency and (iii) breeding mice to homozygosity and housing a mouse colony generate further delays and costs.	low frequency	0.2647058823529411
3CIS7GGG65JS8I3AZ9RG54AE4N6EU8	biomed	BMP family members are now known to play an extremely diverse set of roles in a wide variety of developmental processes [4].	diverse set	0.2647058823529411
39I4RL8QGJH5BU0XA484D39XXQAH44	biomed	To facilitate the functional analysis of the ACDP gene family, we cloned and characterized Acdp, the mouse homologue of the human ACDP gene family.	functional analysis	0.2666666666666667
3FI30CQHVKJ9Z41PT0RNOQQDY4B6BY	biomed	Moreover, the observed transcriptional shift in ETS signaling is paired with the onset of appropriate regulation of neuronal subtype specification and establishment of axonal projections into the target area.	target area	0.2666666666666667
36MUZ9VAE626RGSODE1RV46QINBEDY	biomed	A plausible model is that Dmrt7 evolved during the establishment of mammalian sex determination to help cope with ancestral differences in gene dosage, chromosome pairing, recombination, or other meiotic issues arising from sex chromosome heteromorphy.	sex determination	0.2666666666666667
3KI0JD2ZU1IMXSYZGJF7JO4HFEK67C	biomed	The switch that controls sex determination is biologically diverse.	sex determination	0.296875
3V8JSVE8YYQ9PRNF9AO58PGR0BHEY6	biomed	In these two spontaneous mutants [1] and in the Itpr1-deficient mouse [4] generated by gene targeting, decreased Itpr1 expression is associated with the same autosomal recessive movement disorder (Figure 1).	movement disorder	0.275
3EGKVCRQFWSBIOBVZJMF7HA6XE4BY3	biomed	DNA repair enzymes repair the frequent damage to DNA caused by oxidant stress as well as other stresses, including bulky adducts derived from carcinogens in cigarette smoke [8].	frequent damage	0.2763157894736842
36U4VBVNQODHHM8FLFBG4B9XJCVUR0	biomed	Based on these data, Crx was hypothesized to play a critical role in the differentiation and maintainance of photoreceptor cells [5,7].	critical role	0.2763157894736842
3VGZ74AYTGGU62I1JDW4B19KA3ECGD	biomed	These results demonstrate important epistatic interactions between genes from 129 and C57BL/6 genomes on the development of autoimmunity and illustrate the important effects of background genes in the analysis and interpretation of autoimmune phenotypes associated with targeted genetic disruptions.	important effects	0.2777777777777778
3OQQD2WO8I6KPTSDG8L63AI6J3TI3D	biomed	The homozygous mice for the conditional allele are viable and indistinguishable to the normal mice, allowing us to study the roles of Apc in a tissue- and temporal-specific manner.	normal mice	0.27941176470588236
3N7PQ0KLI5P89OQRKPVFIVKERAM3EP	biomed	However, some susceptibility loci have been mapped to similar chromosome locations in different strains, suggesting that at least some susceptibility may be shared amongst lupus-prone strains.	different strains	0.27941176470588236
3LN3BXKGC0V3K0O604W5NVGN2JWWG6	biomed	All of these findings raise many questions as to the possible role(s) of alpha-crystallin in the nucleus and in cell cycle regulation during differentiation.	many questions	0.27941176470588236
3D4BBDG7ZHWTCQ6DOYPKS7KB6Y9C35	biomed	MCAD-deficient patients have abnormal plasma and urine metabolites associated with the medium chainlength enzyme specificity.	medium chain	0.27941176470588236
3BFNCI9LYKQN09BHXHH9CLSX5NI373	biomed	Many of these dimorphisms affect somatic cells, but the sexual dimorphisms that most directly mediate sexual reproduction are those of the gametes themselves.	sexual reproduction	0.27941176470588236
3BDORL6HKKDLVSRFZOQGA5NRCCPRCO	biomed	In the adult spinal cord, while motor neurons express high levels of NT-3, other cells, including glia, also express it (Zhou and Rush 1994; Dreyfus et al. 1999; Buck et al. 2000).	high levels	0.28125
3CMV9YRYP31X08284WA6BXRNW49LJ6	biomed	The same mechanism seems to apply in vivo with Aqp2F204V/+ mice.	same mechanism	0.2833333333333333
3W0KKJIARR9XWLO7SS1E775URTA8K6	biomed	We have employed the same approach to analyse the genetic basis of disease inheritance in the (129  C57BL/6) hybrid strain, the most common genetic background in gene-targeted mice.	same approach	0.2833333333333333
3VW0145YLYCH6QKT48BLBA6CW9ZJM6	biomed	The new information of the current work includes: 1).	new information	0.2833333333333333
3538U0YQ1FU0F2QNF0FL0D5E3B13F7	biomed	Abnormal lysosomal storage bodies and large vacuoles have been found in skin and conjuctival biopsies using electron-microscopy and, prior to gene identification, served as the only means of diagnosis [3-5].	only means	0.2857142857142857
3NCN4N1H1GHH6P7HSHD4Q1CZTU0BND	biomed	Mice with or without intact dopamine D2R-mediated signaling displayed similar decreases in latencies to retrieve unhidden food pellets (Fig. 1) and learned to dig for food buried in unscented sand (Fig. 2).	unscented sand	0.2875
3Y40HMYLL1I1EIURUEH8TTVLKTGUXW	biomed	Mutations in either Gdf5 or the closely related Gdf6 gene also block formation of joints at specific locations, providing strong evidence that these molecules are essential for the joint formation process (Storm et al. 1994; Settle et al. 2003).	specific locations	0.2894736842105263
3CESM1J3EI31N7Z0ORNJB43Y85T6WE	biomed	This conclusion is consistent with the finding that severely reduced levels of huntingtin, from a hypomorphic Hdh allele, lead to abnormal brains later in embryonic development [15].	embryonic development	0.2894736842105263
3VI0PC2ZAYK61DAUYS5ZUN3W27TOXE	biomed	Although a mechanistic understanding of why a deficiency in cholesterol biosynthesis leads to abnormal embryonic development is lacking, a frequently advanced explanation has been that Shh signaling, involved in early developmental patterning, may be disrupted.	embryonic development	0.475
3UL5XDRDNCJUE234L5X85IMCU3F85L	biomed	These findings represent a novel role for T-box gene action in embryonic development and provide evidence for a previously unappreciated complexity to acquisition of dorsoventral positional identity in mammalian skin.	embryonic development	0.6
3R15W654VDTEMV6LZMUF8Y39AZ1QL2	biomed	Recent studies with floxed alleles suggest that Bmpr1a is also required for many later developmental events, but its roles in bone and joint formation have not yet been tested (Mishina 2003).	joint formation	0.2941176470588235
3R16PJFTS3RWDK15GPB1QVPPP7DK4A	biomed	In addition, levels of Bmpr1a mRNA and protein may persist for some time following Gdf5-Cre stimulated recombination, making it possible to bypass an early requirement for Bmpr1a in joint formation at some locations.	joint formation	0.44999999999999996
31MCUE39BKM6T2MIQKL3IY5Q4Q1G3J	biomed	At some sites, loss of Bmpr1a function leads to a defect in the early stages of joint formation, resulting in a complete failure to form a joint and fusion of bones in the ankle.	joint formation	0.47058823529411764
3P6ENY9P79WZJ1ZCVTA874JG28BIHK	biomed	EFW assisted in the production of the AlphaA/BKO mice, experimental design, and initial fixation of samples.	experimental design	0.2941176470588235
3FI30CQHVKJ9Z41PT0RNOQQDY4BB63	biomed	Second, in an independent study, Powell was able to compare derivatives of CAPAN-1 that differed only in their ability to express full-length BRCA2 protein (S. Powell, personal communication, 2001).	personal communication	0.296875
3VDI8GSXAFTSUZSO21GZ9FD1KCTG8B	biomed	Currently it is held that excitatory dopamine D1Rs mediate the acquisition and expression of several conditioned behaviors involving food reinforcers [e.g. [6,7]] as well as responding for conditioned cues predictive of cocaine delivery [9]  consistent with the interpretation that D1R mediated signaling might modulate the maintenance of stimulus-response outcomes.	cocaine delivery	0.296875
3LG268AV3860SQBTVFWB0TNUXO2ER4	biomed	One of the most curious findings in the rd7 mutant retina was the occurrence of two different types of changes: an increase in the number of S-opsinexpressing cones and a transformation of rods into hybrid photoreceptors.	curious findings	0.30000000000000004
3I6NF2WGIGW97H9M439WXV3AIMS5GY	biomed	Although over-expression of calpastatin, the endogenous protein inhibitor of - and m-calpain provides an important approach for these efforts, it will not distinguish isoform specific functions [24,26,27].	important approach	0.30000000000000004
3KTCJ4SCVG1AB94PEJ5F7AAQ2S01ML	biomed	Although advances in the medical management of pulmonary hypoplasia may have decreased the mortality associated with CDH patients who survive to receive care at high-volume centers [2,3], the population-based mortality has been reported to be as great as 62%, and there are a large number of deaths prior to birth or to transfer to a tertiary care facility [4].	medical management	0.30000000000000004
3MZ3TAMYTLNC8VDFRYM2L8LMPH9IRH	biomed	Alpha-crystallin may play a functional role in the cell nucleus and may have a role in regulating the cell cycle.	functional role	0.30000000000000004
3MNJFORX8B43THDRTJ3EFA3YH7S5FZ	biomed	For each, there has to be a question as to whether the anti-nuclear autoimmunity is due to the gene-targeted mutant gene or to the normal 129 genes expressed in the same region as the targeted gene.	same region	0.3026315789473685
3909MD9T2ZH3P06K4KWHJ49BU0REF9	biomed	The testis and ovary represent two divergent pathways of development from the bipotential embryonic gonad.	divergent pathways	0.3035714285714286
3B9J25CZ25DXW7RSEDQL0FSNYE8CSX	biomed	The vesicle formation goes along with several other changes in the red blood cell like cytoskeletal rearrangements and changes in the phospholipid orientation in the cellular membrane.	blood cell	0.3055555555555556
3J9L0X0VDFMO5Q1YMYQVVEU0Y61W9F	biomed	These data suggest the basis for the performance deficit on the rotating rod task in the Syt IV mutants is in motor coordination rather than in motor learning.	motor learning	0.3055555555555556
3OKP4QVBP2X6DNL3ZZ0D56JWA0TAG9	biomed	PW designed and coordinated the immunocytochemical, morphometrical and molecular biological experiments.	biological experiments	0.3088235294117647
3FJ2RVH25Z62TA3R8E1O77EBUZ6293	biomed	It is also clear that in this genetic system, we have raised the production of A to levels not found in humans to accelerate pathology into an experimentally feasible time frame.	time frame	0.3088235294117647
3XDJY5RK5SLAGG6HA3F3WIYNRYCU4I	biomed	The Gdf5-Cre system provides a new method for restricting gene expression or inactivation primarily to articular regions, thus avoiding the pleiotropic functions of many genes in other tissues.	new method	0.3088235294117647
3BJKPTD2QCC2H9TQLAL6ZFNV0YPRT7	biomed	DLB conceived and designed the study, carried out sample preparation, confocal microscopy, scanning electron microscopy, statistical analysis, and drafted the manuscript.	statistical analysis	0.3088235294117647
3R5OYNIC2C9H5WDB8IHHUKNGZG0PTC	biomed	The deH allele is caused by a large deletion that removes most of the Tbx15 coding sequence, but the pleiotropic phenotype is caused by a simple loss of function for Tbx15 rather than a dominant-negative or contiguous gene effect.	simple loss	0.3125
37OPIVELUU3KDJGEJ5IVQ6VXP06HAF	biomed	Consistent with this expression, we found that most mutant male germ cells arrest in pachynema and undergo apoptosis, although a small proportion can progress to diplonema and sometimes beyond.	small proportion	0.3125
37SQU136V7ODFKI0LXMHNIMN4H411C	biomed	First, it is possible that there are two distinct types of rod precursor; loss of Nr2e3 in one leads to S-cone fate and in the other results in a hybrid cell type.	cell type	0.31666666666666665
3TZ0XG8CBUKDFP5GOVAPHYREGZY98D	biomed	It has been reported that the Xenopus ADAM11 ortholog, xMDC11a, has an expression pattern associated with neural development, with a proposed role in cell migration [24]; and it has been reported in analyses using Northern blot and in situ hybridisation methods that the murine Adam11 gene is expressed in both the developing and adult nervous system [19,25].	nervous system	0.31666666666666665
3EKTG13IZU3N1G8T7TNYRPJ40Y4LMA	biomed	These findings led us to hypothesize that ADAM22 is an integrin binder and plays an important role in the nervous system, as does ADAM23.	nervous system	0.33333333333333337
35F6NGNVM8JSZQ9BCWN0UYWVZMVT7A	biomed	In mouse ES cells, we show that CAF-1 is also required for regular levels of H4K20me3 at pericentric repeats, but not at IAP elements, which are repeated sequences spread all over the mouse genome.	regular levels	0.31666666666666665
3EHVO81VN5LOJV3ENMP2F52UL611HC	biomed	Females and males inherit (on average) the same genes that may be risk factors, but their expression and effect on disease risk varies significantly.	disease risk	0.3194444444444444
335VBRURDJ0UOQF71YWP98N0R2WE9H	biomed	Thus, targeted genetic disruption of candidate genes encoding proteins of the immune system has been extensively used to examine their role in immune regulation.	immune system	0.3194444444444444
3EN4YVUOUCSS02JXIFDUMRMA3DIXJ3	biomed	This phenotypeincreased urinary output and water intakeshowed complete concordance with homozygosity of the F204V mutation in the 58 animals tested.	water intake	0.3194444444444444
36FQTHX3Z3RA2LE7AYTPHNETOD9B3X	biomed	Here we report that dopamine D2R-mediated signaling must be intact if a mouse is to efficiently learn to associate a food reinforcer with a specific odor and then adaptively disengage inappropriate behavioral strategies following the reversal of reinforcement contingencies.	specific odor	0.3214285714285714
3SD15I2WD2U4W9XCE7CH67S1ACY637	biomed	We show here the utility of investigating spontaneous mouse mutations in understanding human disease.	human disease	0.32352941176470584
3YZ7A3YHR5TCXMIDZ33DM9MD6XM5SI	biomed	The objective of the present study was to create genetically engineered murine models of MSUD that mimic the pathology of the classic and intermediate variant forms of the human disease.	human disease	0.3382352941176471
338431Z1FLFM4HOIPTZ755H81Q8ORI	biomed	While most studies focused on the role of DNA methylation and histone modifying enzymes [3], our data point to the importance of the chromatin assembly machinery.	data point	0.32499999999999996
3B9XR6P1WEVLNZGWDJLCXUVIKAVBJ9	biomed	Family history [1] is the strongest risk factor for cardiovascular diseases (CVD).	cardiovascular diseases	0.32499999999999996
3J9L0X0VDFMO5Q1YMYQVVEU0Y619WS	biomed	In contrast, interactions between 2PM/2M QTL and hg primarily affect fat deposition (Table 3).	fat deposition	0.32499999999999996
3L21G7IH47WA5QT3XMTQ15XXB2D1YA	biomed	These findings demonstrate very distinct activities of one transcriptional regulator at different developmental steps within a committed post-mitotic neuronal lineage.	distinct activities	0.32894736842105265
